char,codepoint,name,block
ğ’Š,U+1238A,CUNEIFORM SIGN LU2 TIMES ESH2 PLUS LAL,Cuneiform
ğ’‹,U+1238B,CUNEIFORM SIGN LU2 TIMES SHU,Cuneiform
ğ’Œ,U+1238C,CUNEIFORM SIGN MESH,Cuneiform
ğ’,U+1238D,CUNEIFORM SIGN MUSH3 TIMES ZA,Cuneiform
ğ’,U+1238E,CUNEIFORM SIGN NA4,Cuneiform
ğ’,U+1238F,CUNEIFORM SIGN NIN,Cuneiform
ğ’,U+12390,CUNEIFORM SIGN NIN9,Cuneiform
ğ’‘,U+12391,CUNEIFORM SIGN NINDA2 TIMES BAL,Cuneiform
ğ’’,U+12392,CUNEIFORM SIGN NINDA2 TIMES GI,Cuneiform
ğ’“,U+12393,CUNEIFORM SIGN NU11 ROTATED NINETY DEGREES,Cuneiform
ğ’”,U+12394,CUNEIFORM SIGN PESH2 ASTERISK,Cuneiform
ğ’•,U+12395,CUNEIFORM SIGN PIR2,Cuneiform
ğ’–,U+12396,CUNEIFORM SIGN SAG TIMES IGI GUNU,Cuneiform
ğ’—,U+12397,CUNEIFORM SIGN TI2,Cuneiform
ğ’˜,U+12398,CUNEIFORM SIGN UM TIMES ME,Cuneiform
ğ’™,U+12399,CUNEIFORM SIGN U U,Cuneiform
ğ’€,U+12400,CUNEIFORM NUMERIC SIGN TWO ASH,Cuneiform Numbers and Punctuation
ğ’,U+12401,CUNEIFORM NUMERIC SIGN THREE ASH,Cuneiform Numbers and Punctuation
ğ’‚,U+12402,CUNEIFORM NUMERIC SIGN FOUR ASH,Cuneiform Numbers and Punctuation
ğ’ƒ,U+12403,CUNEIFORM NUMERIC SIGN FIVE ASH,Cuneiform Numbers and Punctuation
ğ’„,U+12404,CUNEIFORM NUMERIC SIGN SIX ASH,Cuneiform Numbers and Punctuation
ğ’…,U+12405,CUNEIFORM NUMERIC SIGN SEVEN ASH,Cuneiform Numbers and Punctuation
ğ’†,U+12406,CUNEIFORM NUMERIC SIGN EIGHT ASH,Cuneiform Numbers and Punctuation
ğ’‡,U+12407,CUNEIFORM NUMERIC SIGN NINE ASH,Cuneiform Numbers and Punctuation
ğ’ˆ,U+12408,CUNEIFORM NUMERIC SIGN THREE DISH,Cuneiform Numbers and Punctuation
ğ’‰,U+12409,CUNEIFORM NUMERIC SIGN FOUR DISH,Cuneiform Numbers and Punctuation
ğ’Š,U+1240A,CUNEIFORM NUMERIC SIGN FIVE DISH,Cuneiform Numbers and Punctuation
ğ’‹,U+1240B,CUNEIFORM NUMERIC SIGN SIX DISH,Cuneiform Numbers and Punctuation
ğ’Œ,U+1240C,CUNEIFORM NUMERIC SIGN SEVEN DISH,Cuneiform Numbers and Punctuation
ğ’,U+1240D,CUNEIFORM NUMERIC SIGN EIGHT DISH,Cuneiform Numbers and Punctuation
ğ’,U+1240E,CUNEIFORM NUMERIC SIGN NINE DISH,Cuneiform Numbers and Punctuation
ğ’,U+1240F,CUNEIFORM NUMERIC SIGN FOUR U,Cuneiform Numbers and Punctuation
ğ’,U+12410,CUNEIFORM NUMERIC SIGN FIVE U,Cuneiform Numbers and Punctuation
ğ’‘,U+12411,CUNEIFORM NUMERIC SIGN SIX U,Cuneiform Numbers and Punctuation
ğ’’,U+12412,CUNEIFORM NUMERIC SIGN SEVEN U,Cuneiform Numbers and Punctuation
ğ’“,U+12413,CUNEIFORM NUMERIC SIGN EIGHT U,Cuneiform Numbers and Punctuation
ğ’”,U+12414,CUNEIFORM NUMERIC SIGN NINE U,Cuneiform Numbers and Punctuation
ğ’•,U+12415,CUNEIFORM NUMERIC SIGN ONE GESH2,Cuneiform Numbers and Punctuation
ğ’–,U+12416,CUNEIFORM NUMERIC SIGN TWO GESH2,Cuneiform Numbers and Punctuation
ğ’—,U+12417,CUNEIFORM NUMERIC SIGN THREE GESH2,Cuneiform Numbers and Punctuation
ğ’˜,U+12418,CUNEIFORM NUMERIC SIGN FOUR GESH2,Cuneiform Numbers and Punctuation
ğ’™,U+12419,CUNEIFORM NUMERIC SIGN FIVE GESH2,Cuneiform Numbers and Punctuation
ğ’š,U+1241A,CUNEIFORM NUMERIC SIGN SIX GESH2,Cuneiform Numbers and Punctuation
ğ’›,U+1241B,CUNEIFORM NUMERIC SIGN SEVEN GESH2,Cuneiform Numbers and Punctuation
ğ’œ,U+1241C,CUNEIFORM NUMERIC SIGN EIGHT GESH2,Cuneiform Numbers and Punctuation
ğ’,U+1241D,CUNEIFORM NUMERIC SIGN NINE GESH2,Cuneiform Numbers and Punctuation
ğ’,U+1241E,CUNEIFORM NUMERIC SIGN ONE GESHU,Cuneiform Numbers and Punctuation
ğ’Ÿ,U+1241F,CUNEIFORM NUMERIC SIGN TWO GESHU,Cuneiform Numbers and Punctuation
ğ’ ,U+12420,CUNEIFORM NUMERIC SIGN THREE GESHU,Cuneiform Numbers and Punctuation
ğ’¡,U+12421,CUNEIFORM NUMERIC SIGN FOUR GESHU,Cuneiform Numbers and Punctuation
ğ’¢,U+12422,CUNEIFORM NUMERIC SIGN FIVE GESHU,Cuneiform Numbers and Punctuation
ğ’£,U+12423,CUNEIFORM NUMERIC SIGN TWO SHAR2,Cuneiform Numbers and Punctuation
ğ’¤,U+12424,CUNEIFORM NUMERIC SIGN THREE SHAR2,Cuneiform Numbers and Punctuation
ğ’¥,U+12425,CUNEIFORM NUMERIC SIGN THREE SHAR2 VARIANT FORM,Cuneiform Numbers and Punctuation
ğ’¦,U+12426,CUNEIFORM NUMERIC SIGN FOUR SHAR2,Cuneiform Numbers and Punctuation
ğ’§,U+12427,CUNEIFORM NUMERIC SIGN FIVE SHAR2,Cuneiform Numbers and Punctuation
ğ’¨,U+12428,CUNEIFORM NUMERIC SIGN SIX SHAR2,Cuneiform Numbers and Punctuation
ğ’©,U+12429,CUNEIFORM NUMERIC SIGN SEVEN SHAR2,Cuneiform Numbers and Punctuation
ğ’ª,U+1242A,CUNEIFORM NUMERIC SIGN EIGHT SHAR2,Cuneiform Numbers and Punctuation
ğ’«,U+1242B,CUNEIFORM NUMERIC SIGN NINE SHAR2,Cuneiform Numbers and Punctuation
ğ’¬,U+1242C,CUNEIFORM NUMERIC SIGN ONE SHARU,Cuneiform Numbers and Punctuation
ğ’­,U+1242D,CUNEIFORM NUMERIC SIGN TWO SHARU,Cuneiform Numbers and Punctuation
ğ’®,U+1242E,CUNEIFORM NUMERIC SIGN THREE SHARU,Cuneiform Numbers and Punctuation
ğ’¯,U+1242F,CUNEIFORM NUMERIC SIGN THREE SHARU VARIANT FORM,Cuneiform Numbers and Punctuation
ğ’°,U+12430,CUNEIFORM NUMERIC SIGN FOUR SHARU,Cuneiform Numbers and Punctuation
ğ’±,U+12431,CUNEIFORM NUMERIC SIGN FIVE SHARU,Cuneiform Numbers and Punctuation
ğ’²,U+12432,CUNEIFORM NUMERIC SIGN SHAR2 TIMES GAL PLUS DISH,Cuneiform Numbers and Punctuation
ğ’³,U+12433,CUNEIFORM NUMERIC SIGN SHAR2 TIMES GAL PLUS MIN,Cuneiform Numbers and Punctuation
ğ’´,U+12434,CUNEIFORM NUMERIC SIGN ONE BURU,Cuneiform Numbers and Punctuation
ğ’µ,U+12435,CUNEIFORM NUMERIC SIGN TWO BURU,Cuneiform Numbers and Punctuation
ğ’¶,U+12436,CUNEIFORM NUMERIC SIGN THREE BURU,Cuneiform Numbers and Punctuation
ğ’·,U+12437,CUNEIFORM NUMERIC SIGN THREE BURU VARIANT FORM,Cuneiform Numbers and Punctuation
ğ’¸,U+12438,CUNEIFORM NUMERIC SIGN FOUR BURU,Cuneiform Numbers and Punctuation
ğ’¹,U+12439,CUNEIFORM NUMERIC SIGN FIVE BURU,Cuneiform Numbers and Punctuation
ğ’º,U+1243A,CUNEIFORM NUMERIC SIGN THREE VARIANT FORM ESH16,Cuneiform Numbers and Punctuation
ğ’»,U+1243B,CUNEIFORM NUMERIC SIGN THREE VARIANT FORM ESH21,Cuneiform Numbers and Punctuation
ğ’¼,U+1243C,CUNEIFORM NUMERIC SIGN FOUR VARIANT FORM LIMMU,Cuneiform Numbers and Punctuation
ğ’½,U+1243D,CUNEIFORM NUMERIC SIGN FOUR VARIANT FORM LIMMU4,Cuneiform Numbers and Punctuation
ğ’¾,U+1243E,CUNEIFORM NUMERIC SIGN FOUR VARIANT FORM LIMMU A,Cuneiform Numbers and Punctuation
ğ’¿,U+1243F,CUNEIFORM NUMERIC SIGN FOUR VARIANT FORM LIMMU B,Cuneiform Numbers and Punctuation
ğ’‘€,U+12440,CUNEIFORM NUMERIC SIGN SIX VARIANT FORM ASH9,Cuneiform Numbers and Punctuation
ğ’‘,U+12441,CUNEIFORM NUMERIC SIGN SEVEN VARIANT FORM IMIN3,Cuneiform Numbers and Punctuation
ğ’‘‚,U+12442,CUNEIFORM NUMERIC SIGN SEVEN VARIANT FORM IMIN A,Cuneiform Numbers and Punctuation
ğ’‘ƒ,U+12443,CUNEIFORM NUMERIC SIGN SEVEN VARIANT FORM IMIN B,Cuneiform Numbers and Punctuation
ğ’‘„,U+12444,CUNEIFORM NUMERIC SIGN EIGHT VARIANT FORM USSU,Cuneiform Numbers and Punctuation
ğ’‘…,U+12445,CUNEIFORM NUMERIC SIGN EIGHT VARIANT FORM USSU3,Cuneiform Numbers and Punctuation
ğ’‘†,U+12446,CUNEIFORM NUMERIC SIGN NINE VARIANT FORM ILIMMU,Cuneiform Numbers and Punctuation
ğ’‘‡,U+12447,CUNEIFORM NUMERIC SIGN NINE VARIANT FORM ILIMMU3,Cuneiform Numbers and Punctuation
ğ’‘ˆ,U+12448,CUNEIFORM NUMERIC SIGN NINE VARIANT FORM ILIMMU4,Cuneiform Numbers and Punctuation
ğ’‘‰,U+12449,CUNEIFORM NUMERIC SIGN NINE VARIANT FORM ILIMMU A,Cuneiform Numbers and Punctuation
ğ’‘Š,U+1244A,CUNEIFORM NUMERIC SIGN TWO ASH TENU,Cuneiform Numbers and Punctuation
ğ’‘‹,U+1244B,CUNEIFORM NUMERIC SIGN THREE ASH TENU,Cuneiform Numbers and Punctuation
ğ’‘Œ,U+1244C,CUNEIFORM NUMERIC SIGN FOUR ASH TENU,Cuneiform Numbers and Punctuation
ğ’‘,U+1244D,CUNEIFORM NUMERIC SIGN FIVE ASH TENU,Cuneiform Numbers and Punctuation
ğ’‘,U+1244E,CUNEIFORM NUMERIC SIGN SIX ASH TENU,Cuneiform Numbers and Punctuation
ğ’‘,U+1244F,CUNEIFORM NUMERIC SIGN ONE BAN2,Cuneiform Numbers and Punctuation
ğ’‘,U+12450,CUNEIFORM NUMERIC SIGN TWO BAN2,Cuneiform Numbers and Punctuation
ğ’‘‘,U+12451,CUNEIFORM NUMERIC SIGN THREE BAN2,Cuneiform Numbers and Punctuation
ğ’‘’,U+12452,CUNEIFORM NUMERIC SIGN FOUR BAN2,Cuneiform Numbers and Punctuation
ğ’‘“,U+12453,CUNEIFORM NUMERIC SIGN FOUR BAN2 VARIANT FORM,Cuneiform Numbers and Punctuation
ğ’‘”,U+12454,CUNEIFORM NUMERIC SIGN FIVE BAN2,Cuneiform Numbers and Punctuation
ğ’‘•,U+12455,CUNEIFORM NUMERIC SIGN FIVE BAN2 VARIANT FORM,Cuneiform Numbers and Punctuation
ğ’‘–,U+12456,CUNEIFORM NUMERIC SIGN NIGIDAMIN,Cuneiform Numbers and Punctuation
ğ’‘—,U+12457,CUNEIFORM NUMERIC SIGN NIGIDAESH,Cuneiform Numbers and Punctuation
ğ’‘˜,U+12458,CUNEIFORM NUMERIC SIGN ONE ESHE3,Cuneiform Numbers and Punctuation
ğ’‘™,U+12459,CUNEIFORM NUMERIC SIGN TWO ESHE3,Cuneiform Numbers and Punctuation
ğ’‘š,U+1245A,CUNEIFORM NUMERIC SIGN ONE THIRD DISH,Cuneiform Numbers and Punctuation
ğ’‘›,U+1245B,CUNEIFORM NUMERIC SIGN TWO THIRDS DISH,Cuneiform Numbers and Punctuation
ğ’‘œ,U+1245C,CUNEIFORM NUMERIC SIGN FIVE SIXTHS DISH,Cuneiform Numbers and Punctuation
ğ’‘,U+1245D,CUNEIFORM NUMERIC SIGN ONE THIRD VARIANT FORM A,Cuneiform Numbers and Punctuation
ğ’‘,U+1245E,CUNEIFORM NUMERIC SIGN TWO THIRDS VARIANT FORM A,Cuneiform Numbers and Punctuation
ğ’‘Ÿ,U+1245F,CUNEIFORM NUMERIC SIGN ONE EIGHTH ASH,Cuneiform Numbers and Punctuation
ğ’‘ ,U+12460,CUNEIFORM NUMERIC SIGN ONE QUARTER ASH,Cuneiform Numbers and Punctuation
ğ’‘¡,U+12461,CUNEIFORM NUMERIC SIGN OLD ASSYRIAN ONE SIXTH,Cuneiform Numbers and Punctuation
ğ’‘¢,U+12462,CUNEIFORM NUMERIC SIGN OLD ASSYRIAN ONE QUARTER,Cuneiform Numbers and Punctuation
ğ’‘£,U+12463,CUNEIFORM NUMERIC SIGN ONE QUARTER GUR,Cuneiform Numbers and Punctuation
ğ’‘¤,U+12464,CUNEIFORM NUMERIC SIGN ONE HALF GUR,Cuneiform Numbers and Punctuation
ğ’‘¥,U+12465,CUNEIFORM NUMERIC SIGN ELAMITE ONE THIRD,Cuneiform Numbers and Punctuation
ğ’‘¦,U+12466,CUNEIFORM NUMERIC SIGN ELAMITE TWO THIRDS,Cuneiform Numbers and Punctuation
ğ’‘§,U+12467,CUNEIFORM NUMERIC SIGN ELAMITE FORTY,Cuneiform Numbers and Punctuation
ğ’‘¨,U+12468,CUNEIFORM NUMERIC SIGN ELAMITE FIFTY,Cuneiform Numbers and Punctuation
ğ’‘©,U+12469,CUNEIFORM NUMERIC SIGN FOUR U VARIANT FORM,Cuneiform Numbers and Punctuation
ğ’‘ª,U+1246A,CUNEIFORM NUMERIC SIGN FIVE U VARIANT FORM,Cuneiform Numbers and Punctuation
ğ’‘«,U+1246B,CUNEIFORM NUMERIC SIGN SIX U VARIANT FORM,Cuneiform Numbers and Punctuation
ğ’‘¬,U+1246C,CUNEIFORM NUMERIC SIGN SEVEN U VARIANT FORM,Cuneiform Numbers and Punctuation
ğ’‘­,U+1246D,CUNEIFORM NUMERIC SIGN EIGHT U VARIANT FORM,Cuneiform Numbers and Punctuation
ğ’‘®,U+1246E,CUNEIFORM NUMERIC SIGN NINE U VARIANT FORM,Cuneiform Numbers and Punctuation
ğ’‘°,U+12470,CUNEIFORM PUNCTUATION SIGN OLD ASSYRIAN WORD DIVIDER,Cuneiform Numbers and Punctuation
ğ’‘±,U+12471,CUNEIFORM PUNCTUATION SIGN VERTICAL COLON,Cuneiform Numbers and Punctuation
ğ’‘²,U+12472,CUNEIFORM PUNCTUATION SIGN DIAGONAL COLON,Cuneiform Numbers and Punctuation
ğ’‘³,U+12473,CUNEIFORM PUNCTUATION SIGN DIAGONAL TRICOLON,Cuneiform Numbers and Punctuation
ğ’‘´,U+12474,CUNEIFORM PUNCTUATION SIGN DIAGONAL QUADCOLON,Cuneiform Numbers and Punctuation
ğ’’€,U+12480,CUNEIFORM SIGN AB TIMES NUN TENU,Early Dynastic Cuneiform
ğ’’,U+12481,CUNEIFORM SIGN AB TIMES SHU2,Early Dynastic Cuneiform
ğ’’‚,U+12482,CUNEIFORM SIGN AD TIMES ESH2,Early Dynastic Cuneiform
ğ’’ƒ,U+12483,CUNEIFORM SIGN BAD TIMES DISH TENU,Early Dynastic Cuneiform
ğ’’„,U+12484,CUNEIFORM SIGN BAHAR2 TIMES AB2,Early Dynastic Cuneiform
ğ’’…,U+12485,CUNEIFORM SIGN BAHAR2 TIMES NI,Early Dynastic Cuneiform
ğ’’†,U+12486,CUNEIFORM SIGN BAHAR2 TIMES ZA,Early Dynastic Cuneiform
ğ’’‡,U+12487,CUNEIFORM SIGN BU OVER BU TIMES NA2,Early Dynastic Cuneiform
ğ’’ˆ,U+12488,CUNEIFORM SIGN DA TIMES TAK4,Early Dynastic Cuneiform
ğ’’‰,U+12489,CUNEIFORM SIGN DAG TIMES KUR,Early Dynastic Cuneiform
ğ’’Š,U+1248A,CUNEIFORM SIGN DIM TIMES IGI,Early Dynastic Cuneiform
ğ’’‹,U+1248B,CUNEIFORM SIGN DIM TIMES U U U,Early Dynastic Cuneiform
ğ’’Œ,U+1248C,CUNEIFORM SIGN DIM2 TIMES UD,Early Dynastic Cuneiform
ğ’’,U+1248D,CUNEIFORM SIGN DUG TIMES ANSHE,Early Dynastic Cuneiform
ğ’’,U+1248E,CUNEIFORM SIGN DUG TIMES ASH,Early Dynastic Cuneiform
ğ’’,U+1248F,CUNEIFORM SIGN DUG TIMES ASH AT LEFT,Early Dynastic Cuneiform
ğ’’,U+12490,CUNEIFORM SIGN DUG TIMES DIN,Early Dynastic Cuneiform
ğ’’‘,U+12491,CUNEIFORM SIGN DUG TIMES DUN,Early Dynastic Cuneiform
ğ’’’,U+12492,CUNEIFORM SIGN DUG TIMES ERIN2,Early Dynastic Cuneiform
ğ’’“,U+12493,CUNEIFORM SIGN DUG TIMES GA,Early Dynastic Cuneiform
ğ’’”,U+12494,CUNEIFORM SIGN DUG TIMES GI,Early Dynastic Cuneiform
ğ’’•,U+12495,CUNEIFORM SIGN DUG TIMES GIR2 GUNU,Early Dynastic Cuneiform
ğ’’–,U+12496,CUNEIFORM SIGN DUG TIMES GISH,Early Dynastic Cuneiform
ğ’’—,U+12497,CUNEIFORM SIGN DUG TIMES HA,Early Dynastic Cuneiform
ğ’’˜,U+12498,CUNEIFORM SIGN DUG TIMES HI,Early Dynastic Cuneiform
ğ’’™,U+12499,CUNEIFORM SIGN DUG TIMES IGI GUNU,Early Dynastic Cuneiform
ğ’’š,U+1249A,CUNEIFORM SIGN DUG TIMES KASKAL,Early Dynastic Cuneiform
ğ’’›,U+1249B,CUNEIFORM SIGN DUG TIMES KUR,Early Dynastic Cuneiform
ğ’’œ,U+1249C,CUNEIFORM SIGN DUG TIMES KUSHU2,Early Dynastic Cuneiform
ğ’’,U+1249D,CUNEIFORM SIGN DUG TIMES KUSHU2 PLUS KASKAL,Early Dynastic Cuneiform
ğ’’,U+1249E,CUNEIFORM SIGN DUG TIMES LAK-020,Early Dynastic Cuneiform
ğ’’Ÿ,U+1249F,CUNEIFORM SIGN DUG TIMES LAM,Early Dynastic Cuneiform
ğ’’ ,U+124A0,CUNEIFORM SIGN DUG TIMES LAM TIMES KUR,Early Dynastic Cuneiform
ğ’’¡,U+124A1,CUNEIFORM SIGN DUG TIMES LUH PLUS GISH,Early Dynastic Cuneiform
ğ’’¢,U+124A2,CUNEIFORM SIGN DUG TIMES MASH,Early Dynastic Cuneiform
ğ’’£,U+124A3,CUNEIFORM SIGN DUG TIMES MES,Early Dynastic Cuneiform
ğ’’¤,U+124A4,CUNEIFORM SIGN DUG TIMES MI,Early Dynastic Cuneiform
ğ’’¥,U+124A5,CUNEIFORM SIGN DUG TIMES NI,Early Dynastic Cuneiform
ğ’’¦,U+124A6,CUNEIFORM SIGN DUG TIMES PI,Early Dynastic Cuneiform
ğ’’§,U+124A7,CUNEIFORM SIGN DUG TIMES SHE,Early Dynastic Cuneiform
ğ’’¨,U+124A8,CUNEIFORM SIGN DUG TIMES SI GUNU,Early Dynastic Cuneiform
ğ’’©,U+124A9,CUNEIFORM SIGN E2 TIMES KUR,Early Dynastic Cuneiform
ğ’’ª,U+124AA,CUNEIFORM SIGN E2 TIMES PAP,Early Dynastic Cuneiform
ğ’’«,U+124AB,CUNEIFORM SIGN ERIN2 X,Early Dynastic Cuneiform
ğ’’¬,U+124AC,CUNEIFORM SIGN ESH2 CROSSING ESH2,Early Dynastic Cuneiform
ğ’’­,U+124AD,CUNEIFORM SIGN EZEN SHESHIG TIMES ASH,Early Dynastic Cuneiform
ğ’’®,U+124AE,CUNEIFORM SIGN EZEN SHESHIG TIMES HI,Early Dynastic Cuneiform
ğ’’¯,U+124AF,CUNEIFORM SIGN EZEN SHESHIG TIMES IGI GUNU,Early Dynastic Cuneiform
ğ’’°,U+124B0,CUNEIFORM SIGN EZEN SHESHIG TIMES LA,Early Dynastic Cuneiform
ğ’’±,U+124B1,CUNEIFORM SIGN EZEN SHESHIG TIMES LAL,Early Dynastic Cuneiform
ğ’’²,U+124B2,CUNEIFORM SIGN EZEN SHESHIG TIMES ME,Early Dynastic Cuneiform
ğ’’³,U+124B3,CUNEIFORM SIGN EZEN SHESHIG TIMES MES,Early Dynastic Cuneiform
ğ’’´,U+124B4,CUNEIFORM SIGN EZEN SHESHIG TIMES SU,Early Dynastic Cuneiform
ğ’’µ,U+124B5,CUNEIFORM SIGN EZEN TIMES SU,Early Dynastic Cuneiform
ğ’’¶,U+124B6,CUNEIFORM SIGN GA2 TIMES BAHAR2,Early Dynastic Cuneiform
ğ’’·,U+124B7,CUNEIFORM SIGN GA2 TIMES DIM GUNU,Early Dynastic Cuneiform
ğ’’¸,U+124B8,CUNEIFORM SIGN GA2 TIMES DUG TIMES IGI GUNU,Early Dynastic Cuneiform
ğ’’¹,U+124B9,CUNEIFORM SIGN GA2 TIMES DUG TIMES KASKAL,Early Dynastic Cuneiform
ğ’’º,U+124BA,CUNEIFORM SIGN GA2 TIMES EREN,Early Dynastic Cuneiform
ğ’’»,U+124BB,CUNEIFORM SIGN GA2 TIMES GA,Early Dynastic Cuneiform
ğ’’¼,U+124BC,CUNEIFORM SIGN GA2 TIMES GAR PLUS DI,Early Dynastic Cuneiform
ğ’’½,U+124BD,CUNEIFORM SIGN GA2 TIMES GAR PLUS NE,Early Dynastic Cuneiform
ğ’’¾,U+124BE,CUNEIFORM SIGN GA2 TIMES HA PLUS A,Early Dynastic Cuneiform
ğ’’¿,U+124BF,CUNEIFORM SIGN GA2 TIMES KUSHU2 PLUS KASKAL,Early Dynastic Cuneiform
ğ’“€,U+124C0,CUNEIFORM SIGN GA2 TIMES LAM,Early Dynastic Cuneiform
ğ’“,U+124C1,CUNEIFORM SIGN GA2 TIMES LAM TIMES KUR,Early Dynastic Cuneiform
ğ’“‚,U+124C2,CUNEIFORM SIGN GA2 TIMES LUH,Early Dynastic Cuneiform
ğ’“ƒ,U+124C3,CUNEIFORM SIGN GA2 TIMES MUSH,Early Dynastic Cuneiform
ğ’“„,U+124C4,CUNEIFORM SIGN GA2 TIMES NE,Early Dynastic Cuneiform
ğ’“…,U+124C5,CUNEIFORM SIGN GA2 TIMES NE PLUS E2,Early Dynastic Cuneiform
ğ’“†,U+124C6,CUNEIFORM SIGN GA2 TIMES NE PLUS GI,Early Dynastic Cuneiform
ğ’“‡,U+124C7,CUNEIFORM SIGN GA2 TIMES SHIM,Early Dynastic Cuneiform
ğ’“ˆ,U+124C8,CUNEIFORM SIGN GA2 TIMES ZIZ2,Early Dynastic Cuneiform
ğ’“‰,U+124C9,CUNEIFORM SIGN GABA ROTATED NINETY DEGREES,Early Dynastic Cuneiform
ğ’“Š,U+124CA,CUNEIFORM SIGN GESHTIN TIMES U,Early Dynastic Cuneiform
ğ’“‹,U+124CB,CUNEIFORM SIGN GISH TIMES GISH CROSSING GISH,Early Dynastic Cuneiform
ğ’“Œ,U+124CC,CUNEIFORM SIGN GU2 TIMES IGI GUNU,Early Dynastic Cuneiform
ğ’“,U+124CD,CUNEIFORM SIGN GUD PLUS GISH TIMES TAK4,Early Dynastic Cuneiform
ğ’“,U+124CE,CUNEIFORM SIGN HA TENU GUNU,Early Dynastic Cuneiform
ğ’“,U+124CF,CUNEIFORM SIGN HI TIMES ASH OVER HI TIMES ASH,Early Dynastic Cuneiform
ğ’“,U+124D0,CUNEIFORM SIGN KA TIMES BU,Early Dynastic Cuneiform
ğ’“‘,U+124D1,CUNEIFORM SIGN KA TIMES KA,Early Dynastic Cuneiform
ğ’“’,U+124D2,CUNEIFORM SIGN KA TIMES U U U,Early Dynastic Cuneiform
ğ’““,U+124D3,CUNEIFORM SIGN KA TIMES UR,Early Dynastic Cuneiform
ğ’“”,U+124D4,CUNEIFORM SIGN LAGAB TIMES ZU OVER ZU,Early Dynastic Cuneiform
ğ’“•,U+124D5,CUNEIFORM SIGN LAK-003,Early Dynastic Cuneiform
ğ’“–,U+124D6,CUNEIFORM SIGN LAK-021,Early Dynastic Cuneiform
ğ’“—,U+124D7,CUNEIFORM SIGN LAK-025,Early Dynastic Cuneiform
ğ’“˜,U+124D8,CUNEIFORM SIGN LAK-030,Early Dynastic Cuneiform
ğ’“™,U+124D9,CUNEIFORM SIGN LAK-050,Early Dynastic Cuneiform
ğ’“š,U+124DA,CUNEIFORM SIGN LAK-051,Early Dynastic Cuneiform
ğ’“›,U+124DB,CUNEIFORM SIGN LAK-062,Early Dynastic Cuneiform
ğ’“œ,U+124DC,CUNEIFORM SIGN LAK-079 OVER LAK-079 GUNU,Early Dynastic Cuneiform
ğ’“,U+124DD,CUNEIFORM SIGN LAK-080,Early Dynastic Cuneiform
ğ’“,U+124DE,CUNEIFORM SIGN LAK-081 OVER LAK-081,Early Dynastic Cuneiform
ğ’“Ÿ,U+124DF,CUNEIFORM SIGN LAK-092,Early Dynastic Cuneiform
ğ’“ ,U+124E0,CUNEIFORM SIGN LAK-130,Early Dynastic Cuneiform
ğ’“¡,U+124E1,CUNEIFORM SIGN LAK-142,Early Dynastic Cuneiform
ğ’“¢,U+124E2,CUNEIFORM SIGN LAK-210,Early Dynastic Cuneiform
ğ’“£,U+124E3,CUNEIFORM SIGN LAK-219,Early Dynastic Cuneiform
ğ’“¤,U+124E4,CUNEIFORM SIGN LAK-220,Early Dynastic Cuneiform
ğ’“¥,U+124E5,CUNEIFORM SIGN LAK-225,Early Dynastic Cuneiform
ğ’“¦,U+124E6,CUNEIFORM SIGN LAK-228,Early Dynastic Cuneiform
ğ’“§,U+124E7,CUNEIFORM SIGN LAK-238,Early Dynastic Cuneiform
ğ’“¨,U+124E8,CUNEIFORM SIGN LAK-265,Early Dynastic Cuneiform
ğ’“©,U+124E9,CUNEIFORM SIGN LAK-266,Early Dynastic Cuneiform
ğ’“ª,U+124EA,CUNEIFORM SIGN LAK-343,Early Dynastic Cuneiform
ğ’“«,U+124EB,CUNEIFORM SIGN LAK-347,Early Dynastic Cuneiform
ğ’“¬,U+124EC,CUNEIFORM SIGN LAK-348,Early Dynastic Cuneiform
ğ’“­,U+124ED,CUNEIFORM SIGN LAK-383,Early Dynastic Cuneiform
ğ’“®,U+124EE,CUNEIFORM SIGN LAK-384,Early Dynastic Cuneiform
ğ’“¯,U+124EF,CUNEIFORM SIGN LAK-390,Early Dynastic Cuneiform
ğ’“°,U+124F0,CUNEIFORM SIGN LAK-441,Early Dynastic Cuneiform
ğ’“±,U+124F1,CUNEIFORM SIGN LAK-449,Early Dynastic Cuneiform
ğ’“²,U+124F2,CUNEIFORM SIGN LAK-449 TIMES GU,Early Dynastic Cuneiform
ğ’“³,U+124F3,CUNEIFORM SIGN LAK-449 TIMES IGI,Early Dynastic Cuneiform
ğ’“´,U+124F4,CUNEIFORM SIGN LAK-449 TIMES PAP PLUS LU3,Early Dynastic Cuneiform
ğ’“µ,U+124F5,CUNEIFORM SIGN LAK-449 TIMES PAP PLUS PAP PLUS LU3,Early Dynastic Cuneiform
ğ’“¶,U+124F6,CUNEIFORM SIGN LAK-449 TIMES U2 PLUS BA,Early Dynastic Cuneiform
ğ’“·,U+124F7,CUNEIFORM SIGN LAK-450,Early Dynastic Cuneiform
ğ’“¸,U+124F8,CUNEIFORM SIGN LAK-457,Early Dynastic Cuneiform
ğ’“¹,U+124F9,CUNEIFORM SIGN LAK-470,Early Dynastic Cuneiform
ğ’“º,U+124FA,CUNEIFORM SIGN LAK-483,Early Dynastic Cuneiform
ğ’“»,U+124FB,CUNEIFORM SIGN LAK-490,Early Dynastic Cuneiform
ğ’“¼,U+124FC,CUNEIFORM SIGN LAK-492,Early Dynastic Cuneiform
ğ’“½,U+124FD,CUNEIFORM SIGN LAK-493,Early Dynastic Cuneiform
ğ’“¾,U+124FE,CUNEIFORM SIGN LAK-495,Early Dynastic Cuneiform
ğ’“¿,U+124FF,CUNEIFORM SIGN LAK-550,Early Dynastic Cuneiform
ğ’”€,U+12500,CUNEIFORM SIGN LAK-608,Early Dynastic Cuneiform
ğ’”,U+12501,CUNEIFORM SIGN LAK-617,Early Dynastic Cuneiform
ğ’”‚,U+12502,CUNEIFORM SIGN LAK-617 TIMES ASH,Early Dynastic Cuneiform
ğ’”ƒ,U+12503,CUNEIFORM SIGN LAK-617 TIMES BAD,Early Dynastic Cuneiform
ğ’”„,U+12504,CUNEIFORM SIGN LAK-617 TIMES DUN3 GUNU GUNU,Early Dynastic Cuneiform
ğ’”…,U+12505,CUNEIFORM SIGN LAK-617 TIMES KU3,Early Dynastic Cuneiform
ğ’”†,U+12506,CUNEIFORM SIGN LAK-617 TIMES LA,Early Dynastic Cuneiform
ğ’”‡,U+12507,CUNEIFORM SIGN LAK-617 TIMES TAR,Early Dynastic Cuneiform
ğ’”ˆ,U+12508,CUNEIFORM SIGN LAK-617 TIMES TE,Early Dynastic Cuneiform
ğ’”‰,U+12509,CUNEIFORM SIGN LAK-617 TIMES U2,Early Dynastic Cuneiform
ğ’”Š,U+1250A,CUNEIFORM SIGN LAK-617 TIMES UD,Early Dynastic Cuneiform
ğ’”‹,U+1250B,CUNEIFORM SIGN LAK-617 TIMES URUDA,Early Dynastic Cuneiform
ğ’”Œ,U+1250C,CUNEIFORM SIGN LAK-636,Early Dynastic Cuneiform
ğ’”,U+1250D,CUNEIFORM SIGN LAK-648,Early Dynastic Cuneiform
ğ’”,U+1250E,CUNEIFORM SIGN LAK-648 TIMES DUB,Early Dynastic Cuneiform
ğ’”,U+1250F,CUNEIFORM SIGN LAK-648 TIMES GA,Early Dynastic Cuneiform
ğ’”,U+12510,CUNEIFORM SIGN LAK-648 TIMES IGI,Early Dynastic Cuneiform
ğ’”‘,U+12511,CUNEIFORM SIGN LAK-648 TIMES IGI GUNU,Early Dynastic Cuneiform
ğ’”’,U+12512,CUNEIFORM SIGN LAK-648 TIMES NI,Early Dynastic Cuneiform
ğ’”“,U+12513,CUNEIFORM SIGN LAK-648 TIMES PAP PLUS PAP PLUS LU3,Early Dynastic Cuneiform
ğ’””,U+12514,CUNEIFORM SIGN LAK-648 TIMES SHESH PLUS KI,Early Dynastic Cuneiform
ğ’”•,U+12515,CUNEIFORM SIGN LAK-648 TIMES UD,Early Dynastic Cuneiform
ğ’”–,U+12516,CUNEIFORM SIGN LAK-648 TIMES URUDA,Early Dynastic Cuneiform
ğ’”—,U+12517,CUNEIFORM SIGN LAK-724,Early Dynastic Cuneiform
ğ’”˜,U+12518,CUNEIFORM SIGN LAK-749,Early Dynastic Cuneiform
ğ’”™,U+12519,CUNEIFORM SIGN LU2 GUNU TIMES ASH,Early Dynastic Cuneiform
ğ’”š,U+1251A,CUNEIFORM SIGN LU2 TIMES DISH,Early Dynastic Cuneiform
ğ’”›,U+1251B,CUNEIFORM SIGN LU2 TIMES HAL,Early Dynastic Cuneiform
ğ’”œ,U+1251C,CUNEIFORM SIGN LU2 TIMES PAP,Early Dynastic Cuneiform
ğ’”,U+1251D,CUNEIFORM SIGN LU2 TIMES PAP PLUS PAP PLUS LU3,Early Dynastic Cuneiform
ğ’”,U+1251E,CUNEIFORM SIGN LU2 TIMES TAK4,Early Dynastic Cuneiform
ğ’”Ÿ,U+1251F,CUNEIFORM SIGN MI PLUS ZA7,Early Dynastic Cuneiform
ğ’” ,U+12520,CUNEIFORM SIGN MUSH OVER MUSH TIMES GA,Early Dynastic Cuneiform
ğ’”¡,U+12521,CUNEIFORM SIGN MUSH OVER MUSH TIMES KAK,Early Dynastic Cuneiform
ğ’”¢,U+12522,CUNEIFORM SIGN NINDA2 TIMES DIM GUNU,Early Dynastic Cuneiform
ğ’”£,U+12523,CUNEIFORM SIGN NINDA2 TIMES GISH,Early Dynastic Cuneiform
ğ’”¤,U+12524,CUNEIFORM SIGN NINDA2 TIMES GUL,Early Dynastic Cuneiform
ğ’”¥,U+12525,CUNEIFORM SIGN NINDA2 TIMES HI,Early Dynastic Cuneiform
ğ’”¦,U+12526,CUNEIFORM SIGN NINDA2 TIMES KESH2,Early Dynastic Cuneiform
ğ’”§,U+12527,CUNEIFORM SIGN NINDA2 TIMES LAK-050,Early Dynastic Cuneiform
ğ’”¨,U+12528,CUNEIFORM SIGN NINDA2 TIMES MASH,Early Dynastic Cuneiform
ğ’”©,U+12529,CUNEIFORM SIGN NINDA2 TIMES PAP PLUS PAP,Early Dynastic Cuneiform
ğ’”ª,U+1252A,CUNEIFORM SIGN NINDA2 TIMES U,Early Dynastic Cuneiform
ğ’”«,U+1252B,CUNEIFORM SIGN NINDA2 TIMES U PLUS U,Early Dynastic Cuneiform
ğ’”¬,U+1252C,CUNEIFORM SIGN NINDA2 TIMES URUDA,Early Dynastic Cuneiform
ğ’”­,U+1252D,CUNEIFORM SIGN SAG GUNU TIMES HA,Early Dynastic Cuneiform
ğ’”®,U+1252E,CUNEIFORM SIGN SAG TIMES EN,Early Dynastic Cuneiform
ğ’”¯,U+1252F,CUNEIFORM SIGN SAG TIMES SHE AT LEFT,Early Dynastic Cuneiform
ğ’”°,U+12530,CUNEIFORM SIGN SAG TIMES TAK4,Early Dynastic Cuneiform
ğ’”±,U+12531,CUNEIFORM SIGN SHA6 TENU,Early Dynastic Cuneiform
ğ’”²,U+12532,CUNEIFORM SIGN SHE OVER SHE,Early Dynastic Cuneiform
ğ’”³,U+12533,CUNEIFORM SIGN SHE PLUS HUB2,Early Dynastic Cuneiform
ğ’”´,U+12534,CUNEIFORM SIGN SHE PLUS NAM2,Early Dynastic Cuneiform
ğ’”µ,U+12535,CUNEIFORM SIGN SHE PLUS SAR,Early Dynastic Cuneiform
ğ’”¶,U+12536,CUNEIFORM SIGN SHU2 PLUS DUG TIMES NI,Early Dynastic Cuneiform
ğ’”·,U+12537,CUNEIFORM SIGN SHU2 PLUS E2 TIMES AN,Early Dynastic Cuneiform
ğ’”¸,U+12538,CUNEIFORM SIGN SI TIMES TAK4,Early Dynastic Cuneiform
ğ’”¹,U+12539,CUNEIFORM SIGN TAK4 PLUS SAG,Early Dynastic Cuneiform
ğ’”º,U+1253A,CUNEIFORM SIGN TUM TIMES GAN2 TENU,Early Dynastic Cuneiform
ğ’”»,U+1253B,CUNEIFORM SIGN TUM TIMES THREE DISH,Early Dynastic Cuneiform
ğ’”¼,U+1253C,CUNEIFORM SIGN UR2 INVERTED,Early Dynastic Cuneiform
ğ’”½,U+1253D,CUNEIFORM SIGN UR2 TIMES UD,Early Dynastic Cuneiform
ğ’”¾,U+1253E,CUNEIFORM SIGN URU TIMES DARA3,Early Dynastic Cuneiform
